{
  "accepted_credential_classes": [
    "non-production-equivalence-stage-exact-candidate-conformance",
    "non-production-equivalence-stage-exact-head-ci",
    "non-production-equivalence-stage-independent-acceptance",
    "non-production-equivalence-stage-independently-retained-audit",
    "non-production-equivalence-stage-operator-promotion-decision",
    "non-production-equivalence-stage-stage-c-principal-control",
    "non-production-equivalence-tier-actor-authority-separation",
    "non-production-equivalence-tier-failure-behavior-evidence",
    "non-production-equivalence-tier-hook-configuration-evidence",
    "non-production-equivalence-tier-independent-acceptance-evidence",
    "non-production-equivalence-tier-installed-package-launcher-evidence",
    "non-production-equivalence-tier-interruption-evidence",
    "non-production-equivalence-tier-matched-deny-evidence",
    "non-production-equivalence-tier-native-boundary-identity",
    "non-production-equivalence-tier-neighboring-allow-evidence",
    "non-production-equivalence-tier-recovery-evidence",
    "non-production-independent-readback"
  ],
  "accepted_issuer_identities": [
    "authoritative-evidence-authority:claude_code:actor-authority-separation",
    "authoritative-evidence-authority:claude_code:failure-behavior-evidence",
    "authoritative-evidence-authority:claude_code:hook-configuration-evidence",
    "authoritative-evidence-authority:claude_code:independent-acceptance-evidence",
    "authoritative-evidence-authority:claude_code:installed-package-launcher-evidence",
    "authoritative-evidence-authority:claude_code:interruption-evidence",
    "authoritative-evidence-authority:claude_code:matched-deny-evidence",
    "authoritative-evidence-authority:claude_code:native-boundary-identity",
    "authoritative-evidence-authority:claude_code:neighboring-allow-evidence",
    "authoritative-evidence-authority:claude_code:recovery-evidence",
    "authoritative-evidence-authority:codex:actor-authority-separation",
    "authoritative-evidence-authority:codex:independent-acceptance-evidence",
    "authoritative-evidence-authority:codex:installed-package-launcher-evidence",
    "authoritative-evidence-authority:codex:interruption-evidence",
    "authoritative-evidence-authority:codex:recovery-evidence",
    "authoritative-stage-c-authority:exact-candidate-conformance",
    "authoritative-stage-c-authority:exact-head-ci",
    "authoritative-stage-c-authority:independent-acceptance",
    "authoritative-stage-c-authority:independently-retained-audit",
    "authoritative-stage-c-authority:operator-promotion-decision",
    "authoritative-stage-c-authority:stage-c-principal-control"
  ],
  "accepted_source_ids": [
    "equivalence-source:equivalence-tier-claude_code-acceptance",
    "equivalence-source:equivalence-tier-claude_code-failure-behavior",
    "equivalence-source:equivalence-tier-claude_code-hook-configuration",
    "equivalence-source:equivalence-tier-claude_code-interruption",
    "equivalence-source:equivalence-tier-claude_code-launcher",
    "equivalence-source:equivalence-tier-claude_code-matched-deny",
    "equivalence-source:equivalence-tier-claude_code-native-boundary",
    "equivalence-source:equivalence-tier-claude_code-neighboring-allow",
    "equivalence-source:equivalence-tier-claude_code-recovery",
    "equivalence-source:equivalence-tier-claude_code-separation",
    "equivalence-source:equivalence-tier-codex-acceptance",
    "equivalence-source:equivalence-tier-codex-interruption",
    "equivalence-source:equivalence-tier-codex-launcher",
    "equivalence-source:equivalence-tier-codex-recovery",
    "equivalence-source:equivalence-tier-codex-separation",
    "equivalence-source:stage:exact-candidate-conformance",
    "equivalence-source:stage:exact-head-ci",
    "equivalence-source:stage:independent-acceptance",
    "equivalence-source:stage:independently-retained-audit",
    "equivalence-source:stage:operator-promotion-decision",
    "equivalence-source:stage:stage-c-principal-control"
  ],
  "accepted_source_kinds": [
    "actor-authority-separation-observation",
    "custody-interruption-observation",
    "custody-recovery-observation",
    "exact-candidate-conformance-run",
    "exact-head-ci-run",
    "failure-behavior-observation",
    "hook-configuration-readback",
    "independent-acceptance-decision",
    "independent-audit-retention-readback",
    "installed-package-launcher-observation",
    "matched-deny-observation",
    "native-boundary-attestation",
    "native-stage-c-control",
    "neighboring-allow-observation",
    "operator-promotion-decision",
    "tier-independent-acceptance-verdict"
  ],
  "content_digest": "811ed4cd23a19d7d7d760aad435ac46d7d58f2f170bf30bed4c9b354af41213d",
  "decision_roots": [
    "decision-root:sha256:09ce870fd2f5ca7e713a21f7b5931fbd0c34a8a49a65044e05e4939742b3972e",
    "decision-root:sha256:0b22e3ee9735e9c2b72b594618007f26a1bfe29870d3dc259624cd66048aeed9",
    "decision-root:sha256:0b855a26eecfa098628294898d3c71d78988b131d2569da69bc126b6b354512c",
    "decision-root:sha256:277250eac19a83ab74ec70d547c53df42e0002de6a6e37dca73d8f2873787891",
    "decision-root:sha256:3794027f450a85f18cd7489e8f0abd5ccecf98cb6ed7ad33c3f5f0f7452250c5",
    "decision-root:sha256:398e177448f150e953d96f460b342e2281db6a6c879125a01afa1aa762567a25",
    "decision-root:sha256:3ed99be316262d43627a20da3f594fb95fa7cfb38928d16843a14f18e44a4310",
    "decision-root:sha256:432511b543c9b9bebbb04fbb78e557555fcc59473a848d846ddc9a59d6caec98",
    "decision-root:sha256:45f06603ef2884395cc040d758011c69a84a7404d1b4b8521445221295bb22a8",
    "decision-root:sha256:4fc5d56d7758c4a137d94277756a8a2634e495fc17a5692ca8b69b598296b4d7",
    "decision-root:sha256:7fe3f9b7cc8d9301adb7e20cc0812efa32786479e1e094b06d28486f7c833e9e",
    "decision-root:sha256:8676526000840c511b32b93eae40d83839fddb4ea34a6b9ae088dcb558f3c0ce",
    "decision-root:sha256:8f7fdeab4c4c5630e7055cddc7c6207906a364566ffd2b426584ae8b312a3f28",
    "decision-root:sha256:ab4956756a505b743cadadefed83f35a19ae948d59d55f952513f8e9bb7977ab",
    "decision-root:sha256:b28c93244204a1523cd18775d21b79763b10bc0df42b78ba9f53bcb0284a4cdb",
    "decision-root:sha256:c75b91e899509852ca96e939557dd0dc78ec3dc4e5d76af78a0b27e09811ce20",
    "decision-root:sha256:d840faa2415fed5025483ce26b15e4d11a2402cc00ecdc580369e1f441248089",
    "decision-root:sha256:dd32791c10a6f476da8d91f3883080203c613f748aeed6eb3084e9966ef2db24",
    "decision-root:sha256:df3be074fc89b76fc371317297e88fbaeb126ebb9c9c302bfe95a1161b94d5e1",
    "decision-root:sha256:e1bae269eaea1062dec17efc5790a15708aaf56021cd64c25932ee94d29e9894",
    "decision-root:sha256:f9e3af9960c0aab9c11e1c68f2cc33a6362e5ce25348c2d0f157344cd57015e4"
  ],
  "environment": "non-production-authoritative-equivalence",
  "minimum_retention_days": 30,
  "rationale": "Separately pinned trust root for non-production authoritative-equivalence tests only; it does not assert live production evidence.",
  "record": "authoritative-evidence-trust-root@1",
  "required_readback_method": "independent-record-readback@1",
  "revision": "2026-08-14-task2-fix4",
  "source_set_digest": "69fc589adc17a0476e93a68b4e707cf0f3661c5cf59aa62232bf8ac396c642da",
  "transparency_roots": [
    "transparency-root:sha256:1ee5470ff2da68d05cd8fe9a51641477332592fee27964eb4fa13518b4f4cc4a",
    "transparency-root:sha256:25dffff51a7ec3b7851ccc05a6df37c367308c1e0045fb9430308d8f8b601f3d",
    "transparency-root:sha256:27653c6e7926e7e238b2d98fedc535fe878ed075e12846986f0f897ae8dbf9d7",
    "transparency-root:sha256:296c00bbbbdc2d0acbd2ea97b09515175abc489b4a990f14d0be9b00eaf7bc55",
    "transparency-root:sha256:2b939256db7b899c138e48ea8f30677204ce68bc22452cd17ab4d0b758b1a2e2",
    "transparency-root:sha256:50c6a8cae1516ef883c371b79ef43422eeb09c478271dd063fc26441c4640e70",
    "transparency-root:sha256:54c0d89f6411519267cdd6c20f62d45b2a342ca24674201f0259805096c21016",
    "transparency-root:sha256:5e89ccfae3dcc3717f0912b63e59e259ec67aea1b6a20d61ec1605ecde6bc12c",
    "transparency-root:sha256:6b950dfa394c2f4d768aa8f8b901008e31710bf51b70d6023eaa42e356d82697",
    "transparency-root:sha256:86f8c979f48b86e934c0d7c8959a0e7fc3785a96ad309e46f05dd8f0be5fd22d",
    "transparency-root:sha256:8a1d3196d96e02eddfb7684cc962bccb268ab0f481a04295e97c2cb6cbe740d1",
    "transparency-root:sha256:8d15849f69eac4cf30a37ba41adc9edc8b2fc16eb6b2b89c057722d0ea5476a9",
    "transparency-root:sha256:a48ecda7d48b025534bac495a52f6749f0307c183415362342db414f9a619ef9",
    "transparency-root:sha256:a95257198ee50aaaca087c590922839851be20dea6e5ce1b30ef85e5c29806a5",
    "transparency-root:sha256:afc4130ae03cd2d954eec724e2f1328d8b82bd6202382ba64cd5291b5cf88b4c",
    "transparency-root:sha256:b856db22deb03458db06967c4b787d37d538e83a33c22b6cbd3582d894923cf9",
    "transparency-root:sha256:c6e4397a5489f1ec1415b955674729bb8b593ad725774a3fef1f5b2cef87899c",
    "transparency-root:sha256:d54710dfb3e777e01a254e992e4cdd4b68f8d33555fbe14184f4fb41d64bffdc",
    "transparency-root:sha256:e13c9470d7d6109ceb2edc6fb33ab7fd30aa1c909d5c4d92c16e315cbb7c91b8",
    "transparency-root:sha256:e2169a30be3f10b5cbcaf5eb380530046d2d5d44cfb25541966f399cd2cd1a1a",
    "transparency-root:sha256:ed8c5dd87a2acfe91080454c11bcf7033d162756d10da9e048923e56e2a89b82"
  ],
  "trust_root_id": "non-production-authoritative-equivalence-root@1"
}
